Protein identifier	Contig id	Start	Stop	Strand	Gene symbol	Sequence name	Scope	Element type	Element subtype	Class	Subclass	Method	Target length	Reference sequence length	% Coverage of reference sequence	% Identity to reference sequence	Alignment length	Accession of closest sequence	Name of closest sequence	HMM id	HMM description
NA	accn|562.144973.con.0001	5486	6634	-	espX1	type III secretion system effector EspX1	plus	VIRULENCE	VIRULENCE	NA	NA	PARTIALX	383	473	80.97	90.60	383	ADD54679.1	type III secretion system effector EspX1	NA	NA
NA	accn|562.144973.con.0002	163	1140	+	nleB2	type III secretion system effector arginine glycosyltransferase NleB2	plus	VIRULENCE	VIRULENCE	NA	NA	EXACTX	326	326	100.00	100.00	326	CAS08589.1	type III secretion system effector arginine glycosyltransferase NleB2	NA	NA
NA	accn|562.144973.con.0003	1518	2168	-	espJ	type III secretion system effector ADP-ribosyltransferase EspJ	plus	VIRULENCE	VIRULENCE	NA	NA	BLASTX	217	217	100.00	99.54	217	BAF96525.1	type III secretion system effector ADP-ribosyltransferase EspJ	NA	NA
NA	accn|562.144973.con.0009	228	1466	-	nleA	type III secretion system effector NleA	plus	VIRULENCE	VIRULENCE	NA	NA	BLASTX	413	413	100.00	99.76	413	CAM11314.1	type III secretion system effector NleA	NA	NA
NA	accn|562.144973.con.0016	167	2983	-	eae	intimin type kappa	plus	VIRULENCE	VIRULENCE	INTIMIN	KAPPA	EXACTX	939	939	100.00	100.00	939	ABF69110.1	intimin type kappa	NA	NA
NA	accn|562.144973.con.0016	3650	5305	-	tir	type III secretion system LEE translocated intimin receptor Tir	plus	VIRULENCE	VIRULENCE	NA	NA	BLASTX	552	552	100.00	97.64	552	BAA96815.1	type III secretion system LEE translocated intimin receptor Tir	NA	NA
NA	accn|562.144973.con.0016	43423	44610	+	emrD	multidrug efflux MFS transporter EmrD	plus	AMR	AMR	EFFLUX	EFFLUX	BLASTX	396	396	100.00	99.49	396	EFF04178.1	multidrug efflux MFS transporter EmrD	NA	NA
NA	accn|562.144973.con.0025	49197	52298	+	acrF	multidrug efflux RND transporter permease subunit AcrF	plus	AMR	AMR	EFFLUX	EFFLUX	BLASTX	1034	1034	100.00	99.71	1034	AAC76298.1	multidrug efflux RND transporter permease subunit AcrF	NA	NA
NA	accn|562.144973.con.0032	5897	6985	-	pmrB_Y358N	Escherichia colistin resistant PmrB	core	AMR	POINT	COLISTIN	COLISTIN	POINTX	363	363	100.00	99.45	363	WP_001300761.1	two-component system sensor histidine kinase PmrB	NA	NA
NA	accn|562.144973.con.0033	27371	29626	-	parC_A56T	Escherichia quinolone resistant ParC	core	AMR	POINT	QUINOLONE	QUINOLONE	POINTX	752	752	100.00	99.87	752	WP_001281881.1	DNA topoisomerase IV subunit A ParC	NA	NA
NA	accn|562.144973.con.0037	44003	45154	-	glpT_E448K	Escherichia fosfomycin resistant GlpT	core	AMR	POINT	FOSFOMYCIN	FOSFOMYCIN	POINTX	384	452	84.96	98.96	384	WP_000948731.1	glycerol-3-phosphate transporter GlpT	NA	NA
NA	accn|562.144973.con.0038	7361	9448	+	iha	bifunctional siderophore receptor/adhesin Iha	plus	VIRULENCE	VIRULENCE	NA	NA	BLASTX	696	696	100.00	99.86	696	AAG55323.1	bifunctional siderophore receptor/adhesin Iha	NA	NA
NA	accn|562.144973.con.0038	11420	11995	-	terD	tellurium resistance membrane protein TerD	plus	STRESS	METAL	TELLURIUM	TELLURIUM	BLASTX	192	192	100.00	95.31	192	AAA98292.1	tellurium resistance membrane protein TerD	NA	NA
NA	accn|562.144973.con.0038	14745	15323	-	terZ	tellurium resistance-associated protein TerZ	plus	STRESS	METAL	TELLURIUM	TELLURIUM	BLASTX	193	193	100.00	98.96	193	AAA86846.1	tellurium resistance-associated protein TerZ	NA	NA
NA	accn|562.144973.con.0038	21896	22360	+	terW	tellurium resistance protein TerW	plus	STRESS	METAL	TELLURIUM	TELLURIUM	BLASTX	155	155	100.00	99.35	155	AAC44736.1	tellurium resistance protein TerW	NA	NA
NA	accn|562.144973.con.0046	32534	33664	+	blaEC	BlaEC family class C beta-lactamase	plus	AMR	AMR	BETA-LACTAM	BETA-LACTAM	BLASTX	377	377	100.00	97.61	377	WP_063610930.1	extended-spectrum class C beta-lactamase EC-15	NA	NA
NA	accn|562.144973.con.0051	22707	24506	+	ybtP	yersiniabactin ABC transporter ATP-binding/permease protein YbtP	plus	VIRULENCE	VIRULENCE	NA	NA	BLASTX	600	600	100.00	99.67	600	CAA21388.1	yersiniabactin ABC transporter ATP-binding/permease protein YbtP	NA	NA
NA	accn|562.144973.con.0051	24496	26295	+	ybtQ	yersiniabactin ABC transporter ATP-binding/permease protein YbtQ	plus	VIRULENCE	VIRULENCE	NA	NA	BLASTX	600	600	100.00	99.67	600	AAC69584.1	yersiniabactin ABC transporter ATP-binding/permease protein YbtQ	NA	NA
NA	accn|562.144973.con.0054	20124	24371	-	fdeC	inverse autotransporter adhesin FdeC	plus	VIRULENCE	VIRULENCE	NA	NA	BLASTX	1416	1416	100.00	94.07	1416	ABE05822.1	inverse autotransporter adhesin FdeC	NA	NA
NA	accn|562.144973.con.0055	14315	16036	+	iucA	aerobactin synthase IucA	plus	VIRULENCE	VIRULENCE	NA	NA	BLASTX	574	576	100.00	98.61	576	EGI25746.1	aerobactin synthase IucA	NA	NA
NA	accn|562.144973.con.0055	16040	16984	+	iucB	N(6)-hydroxylysine O-acetyltransferase IucB	plus	VIRULENCE	VIRULENCE	NA	NA	EXACTX	315	315	100.00	100.00	315	AAN82074.1	N(6)-hydroxylysine O-acetyltransferase IucB	NA	NA
NA	accn|562.144973.con.0055	16987	18726	+	iucC	NIS family aerobactin synthetase IucC	plus	VIRULENCE	VIRULENCE	NA	NA	EXACTX	580	580	100.00	100.00	580	AAN82073.1	NIS family aerobactin synthetase IucC	NA	NA
NA	accn|562.144973.con.0055	18726	20060	+	iucD	NADPH-dependent L-lysine N(6)-monooxygenase IucD	plus	VIRULENCE	VIRULENCE	NA	NA	BLASTX	445	445	100.00	98.88	445	AAD44749.1	NADPH-dependent L-lysine N(6)-monooxygenase IucD	NA	NA
NA	accn|562.144973.con.0055	20069	22261	+	iutA	ferric aerobactin receptor IutA	plus	VIRULENCE	VIRULENCE	NA	NA	BLASTX	731	731	100.00	99.18	731	AAN45165.2	ferric aerobactin receptor IutA	NA	NA
NA	accn|562.144973.con.0061	11182	12411	+	mdtM	multidrug efflux MFS transporter MdtM	plus	AMR	AMR	EFFLUX	EFFLUX	BLASTX	410	410	100.00	99.76	410	AAC77293.1	multidrug efflux MFS transporter MdtM	NA	NA
NA	accn|562.144973.con.0096	2448	2561	+	astA	heat-stable enterotoxin EAST1	plus	VIRULENCE	VIRULENCE	NA	NA	INTERNAL_STOP	38	38	100.00	94.74	38	AAD43578.1	heat-stable enterotoxin EAST1	NA	NA
NA	accn|562.144973.con.0097	3048	3311	-	ariR	biofilm/acid-resistance regulator AriR	plus	STRESS	ACID	NA	NA	EXACTX	88	88	100.00	100.00	88	AAC74250.1	biofilm/acid-resistance regulator AriR	NA	NA
NA	accn|562.144973.con.0101	1	465	-	espF	type III secretion system LEE effector EspF	plus	VIRULENCE	VIRULENCE	NA	NA	PARTIAL_CONTIG_ENDX	155	206	76.21	90.45	157	AAC38400.1	type III secretion system LEE effector EspF	NA	NA
NA	accn|562.144973.con.0101	1507	2469	-	espB	type III secretion system LEE translocon pore-forming subunit EspB	plus	VIRULENCE	VIRULENCE	NA	NA	EXACTX	321	321	100.00	100.00	321	AAC38396.1	type III secretion system LEE translocon pore-forming subunit EspB	NA	NA
NA	accn|562.144973.con.0101	3645	4214	-	espA	type III secretion system LEE translocon filament protein EspA	plus	VIRULENCE	VIRULENCE	NA	NA	EXACTX	190	190	100.00	100.00	190	CAA12346.1	type III secretion system LEE translocon filament protein EspA	NA	NA
NA	accn|562.144973.con.0113	3302	4147	-	cif	type III secretion system effector Cif	plus	VIRULENCE	VIRULENCE	NA	NA	EXACTX	282	282	100.00	100.00	282	AAQ07241.1	type III secretion system effector Cif	NA	NA
NA	accn|562.144973.con.0192	1	276	+	iss	increased serum survival lipoprotein Iss	plus	VIRULENCE	VIRULENCE	NA	NA	BLASTX	92	97	94.85	100.00	92	AGC85979.1	increased serum survival lipoprotein Iss	NA	NA
