Protein identifier	Contig id	Start	Stop	Strand	Gene symbol	Sequence name	Scope	Element type	Element subtype	Class	Subclass	Method	Target length	Reference sequence length	% Coverage of reference sequence	% Identity to reference sequence	Alignment length	Accession of closest sequence	Name of closest sequence	HMM id	HMM description
NA	accn|LVOM01000009	219	605	+	bleO	bleomycin binding protein	core	AMR	AMR	BLEOMYCIN	BLEOMYCIN	BLASTX	129	134	96.27	100.00	129	WP_001242578.1	bleomycin binding protein	NA	NA
NA	accn|LVOM01000015	67	303	-	ble	bleomycin binding protein BLMT	core	AMR	AMR	BLEOMYCIN	BLEOMYCIN	PARTIALX	79	126	61.11	96.20	79	WP_000131935.1	bleomycin binding protein BLMT	NA	NA
NA	accn|LVOM01000015	327	1118	-	aph(3')-IIa	aminoglycoside O-phosphotransferase APH(3')-IIa	core	AMR	AMR	AMINOGLYCOSIDE	KANAMYCIN	EXACTX	264	264	100.00	100.00	264	WP_000572405.1	aminoglycoside O-phosphotransferase APH(3')-IIa	NA	NA
NA	accn|LVOM01000016	1779	2636	-	aac(3)-IIe	aminoglycoside N-acetyltransferase AAC(3)-IIe	core	AMR	AMR	AMINOGLYCOSIDE	GENTAMICIN	EXACTX	286	286	100.00	100.00	286	WP_000557452.1	aminoglycoside N-acetyltransferase AAC(3)-IIe	NA	NA
NA	accn|LVOM01000017	1005	1862	+	blaTEM-1	broad-spectrum class A beta-lactamase TEM-1	core	AMR	AMR	BETA-LACTAM	BETA-LACTAM	ALLELEX	286	286	100.00	100.00	286	WP_000027057.1	broad-spectrum class A beta-lactamase TEM-1	NA	NA
NA	accn|LVOM01000027	338	1510	+	oqxA	multidrug efflux RND transporter periplasmic adaptor subunit OqxA	core	AMR	AMR	PHENICOL/QUINOLONE	PHENICOL/QUINOLONE	EXACTX	391	391	100.00	100.00	391	WP_002914189.1	multidrug efflux RND transporter periplasmic adaptor subunit OqxA	NA	NA
NA	accn|LVOM01000027	1537	4686	+	oqxB	multidrug efflux RND transporter permease subunit OqxB	core	AMR	AMR	PHENICOL/QUINOLONE	PHENICOL/QUINOLONE	EXACTX	1050	1050	100.00	100.00	1050	WP_000347934.1	multidrug efflux RND transporter permease subunit OqxB	NA	NA
NA	accn|LVOM01000044	20656	24897	-	fdeC	inverse autotransporter adhesin FdeC	plus	VIRULENCE	VIRULENCE	NA	NA	BLASTX	1414	1416	99.93	92.51	1415	ABE05822.1	inverse autotransporter adhesin FdeC	NA	NA
NA	accn|LVOM01000054	49258	49779	-	lpfA	long polar fimbria major subunit LpfA	plus	VIRULENCE	VIRULENCE	NA	NA	EXACTX	174	174	100.00	100.00	174	CAV00478.1	long polar fimbria major subunit LpfA	NA	NA
NA	accn|LVOM01000065	62746	63972	-	mdtM	multidrug efflux MFS transporter MdtM	plus	AMR	AMR	EFFLUX	EFFLUX	BLASTX	409	410	99.76	98.29	409	AAC77293.1	multidrug efflux MFS transporter MdtM	NA	NA
NA	accn|LVOM01000069	159067	159636	-	lpfA-O113	long polar fimbria major subunit LpfA-O113	plus	VIRULENCE	VIRULENCE	NA	NA	BLASTX	190	190	100.00	99.47	190	AAT76975.1	long polar fimbria major subunit LpfA-O113	NA	NA
NA	accn|LVOM01000070	53018	53281	-	ariR	biofilm/acid-resistance regulator AriR	plus	STRESS	ACID	NA	NA	EXACTX	88	88	100.00	100.00	88	AAC74250.1	biofilm/acid-resistance regulator AriR	NA	NA
NA	accn|LVOM01000071	49127	50257	+	blaEC	BlaEC family class C beta-lactamase	plus	AMR	AMR	BETA-LACTAM	BETA-LACTAM	BLASTX	377	377	100.00	98.41	377	WP_063610930.1	extended-spectrum class C beta-lactamase EC-15	NA	NA
NA	accn|LVOM01000071	94792	95880	+	pmrB_Y358N	Escherichia colistin resistant PmrB	core	AMR	POINT	COLISTIN	COLISTIN	POINTX	363	363	100.00	99.45	363	WP_001300761.1	two-component system sensor histidine kinase PmrB	NA	NA
NA	accn|LVOM01000073	200535	201953	+	espX1	type III secretion system effector EspX1	plus	VIRULENCE	VIRULENCE	NA	NA	BLASTX	473	473	100.00	91.33	473	ADD54679.1	type III secretion system effector EspX1	NA	NA
NA	accn|LVOM01000075	5623	8724	-	acrF	multidrug efflux RND transporter permease subunit AcrF	plus	AMR	AMR	EFFLUX	EFFLUX	BLASTX	1034	1034	100.00	99.42	1034	AAC76298.1	multidrug efflux RND transporter permease subunit AcrF	NA	NA
NA	accn|LVOM01000075	253552	255807	+	parC_S80I	Escherichia quinolone resistant ParC	core	AMR	POINT	QUINOLONE	QUINOLONE	POINTX	752	752	100.00	99.87	752	WP_001281881.1	DNA topoisomerase IV subunit A ParC	NA	NA
NA	accn|LVOM01000076	83095	84450	+	glpT_E448K	Escherichia fosfomycin resistant GlpT	core	AMR	POINT	FOSFOMYCIN	FOSFOMYCIN	POINTX	452	452	100.00	99.78	452	WP_000948731.1	glycerol-3-phosphate transporter GlpT	NA	NA
NA	accn|LVOM01000076	95885	98509	+	gyrA_D87N	Escherichia quinolone resistant GyrA	core	AMR	POINT	QUINOLONE	QUINOLONE	POINTX	875	878	99.66	98.97	875	WP_001281243.1	DNA gyrase subunit A GyrA	NA	NA
NA	accn|LVOM01000076	95885	98509	+	gyrA_S83L	Escherichia quinolone resistant GyrA	core	AMR	POINT	QUINOLONE	QUINOLONE	POINTX	875	878	99.66	98.97	875	WP_001281243.1	DNA gyrase subunit A GyrA	NA	NA
NA	accn|LVOM01000077	55241	55570	+	emrE	multidrug efflux SMR transporter EmrE	plus	STRESS	BIOCIDE	EFFLUX	EFFLUX	BLASTX	110	110	100.00	98.18	110	CAA77936.1	multidrug efflux SMR transporter EmrE	NA	NA
