Protein identifier	Contig id	Start	Stop	Strand	Gene symbol	Sequence name	Scope	Element type	Element subtype	Class	Subclass	Method	Target length	Reference sequence length	% Coverage of reference sequence	% Identity to reference sequence	Alignment length	Accession of closest sequence	Name of closest sequence	HMM id	HMM description
NA	accn|562.98287.con.0003	68227	69582	-	glpT_E448K	Escherichia fosfomycin resistant GlpT	core	AMR	POINT	FOSFOMYCIN	FOSFOMYCIN	POINTX	452	452	100.00	99.12	452	WP_000948731.1	glycerol-3-phosphate transporter GlpT	NA	NA
NA	accn|562.98287.con.0005	17339	18757	-	espX1	type III secretion system effector EspX1	plus	VIRULENCE	VIRULENCE	NA	NA	BLASTX	473	473	100.00	91.54	473	ADD54679.1	type III secretion system effector EspX1	NA	NA
NA	accn|562.98287.con.0006	2471	2734	-	ariR	biofilm/acid-resistance regulator AriR	plus	STRESS	ACID	NA	NA	BLASTX	88	88	100.00	96.59	88	AAC74250.1	biofilm/acid-resistance regulator AriR	NA	NA
NA	accn|562.98287.con.0008	78506	79489	+	eilA	HilA family transcriptional regulator EilA	plus	VIRULENCE	VIRULENCE	NA	NA	PARTIALX	328	565	58.05	99.39	328	CBG36837.1	HilA family transcriptional regulator EilA	NA	NA
NA	accn|562.98287.con.0008	92819	94207	-	uhpT_E350Q	Escherichia fosfomycin resistant UhpT	core	AMR	POINT	FOSFOMYCIN	FOSFOMYCIN	POINTX	463	463	100.00	99.78	463	WP_000879194.1	hexose phosphate transporter UhpT	NA	NA
NA	accn|562.98287.con.0008	104309	105496	+	emrD	multidrug efflux MFS transporter EmrD	plus	AMR	AMR	EFFLUX	EFFLUX	BLASTX	396	396	100.00	99.75	396	EFF04178.1	multidrug efflux MFS transporter EmrD	NA	NA
NA	accn|562.98287.con.0011	1343	3388	-	ireA	TonB-dependent siderophore receptor IreA	plus	VIRULENCE	VIRULENCE	NA	NA	EXACTX	682	682	100.00	100.00	682	AAN83596.1	TonB-dependent siderophore receptor IreA	NA	NA
NA	accn|562.98287.con.0023	15056	16186	-	blaEC	BlaEC family class C beta-lactamase	plus	AMR	AMR	BETA-LACTAM	BETA-LACTAM	BLASTX	377	377	100.00	98.94	377	AAZ85965.1	cephalosporin-hydrolyzing class C beta-lactamase EC-5	NA	NA
NA	accn|562.98287.con.0026	7625	10168	-	cyaA_S352T	Escherichia fosmidomycin resistant CyaA	core	AMR	POINT	FOSMIDOMYCIN	FOSMIDOMYCIN	POINTX	848	848	100.00	99.17	848	WP_000281668.1	adenylate cyclase CyaA	NA	NA
NA	accn|562.98287.con.0027	6789	8588	-	ybtQ	yersiniabactin ABC transporter ATP-binding/permease protein YbtQ	plus	VIRULENCE	VIRULENCE	NA	NA	BLASTX	600	600	100.00	99.33	600	AAC69584.1	yersiniabactin ABC transporter ATP-binding/permease protein YbtQ	NA	NA
NA	accn|562.98287.con.0027	8578	10377	-	ybtP	yersiniabactin ABC transporter ATP-binding/permease protein YbtP	plus	VIRULENCE	VIRULENCE	NA	NA	BLASTX	600	600	100.00	99.67	600	CAA21388.1	yersiniabactin ABC transporter ATP-binding/permease protein YbtP	NA	NA
NA	accn|562.98287.con.0028	36146	38035	+	parE_I355T	Escherichia quinolone resistant ParE	core	AMR	POINT	QUINOLONE	QUINOLONE	POINTX	630	630	100.00	99.68	630	WP_033554192.1	DNA topoisomerase IV subunit B ParE	NA	NA
NA	accn|562.98287.con.0040	19648	20217	+	lpfA-O113	long polar fimbria major subunit LpfA-O113	plus	VIRULENCE	VIRULENCE	NA	NA	BLASTX	190	190	100.00	98.42	190	ACB16424.1	long polar fimbria major subunit LpfA-O113	NA	NA
NA	accn|562.98287.con.0076	5751	7838	+	iha	bifunctional siderophore receptor/adhesin Iha	plus	VIRULENCE	VIRULENCE	NA	NA	BLASTX	696	696	100.00	99.86	696	AAG55323.1	bifunctional siderophore receptor/adhesin Iha	NA	NA
NA	accn|562.98287.con.0076	15839	18259	-	sat	serine protease autotransporter toxin Sat	plus	VIRULENCE	VIRULENCE	NA	NA	PARTIAL_CONTIG_ENDX	807	1295	62.32	99.88	807	CAE55775.1	serine protease autotransporter toxin Sat	NA	NA
NA	accn|562.98287.con.0077	9170	13411	-	fdeC	inverse autotransporter adhesin FdeC	plus	VIRULENCE	VIRULENCE	NA	NA	BLASTX	1414	1416	99.93	91.02	1415	ABE05822.1	inverse autotransporter adhesin FdeC	NA	NA
NA	accn|562.98287.con.0080	2409	4601	-	iutA	ferric aerobactin receptor IutA	plus	VIRULENCE	VIRULENCE	NA	NA	BLASTX	731	731	100.00	99.73	731	AAN45165.2	ferric aerobactin receptor IutA	NA	NA
NA	accn|562.98287.con.0080	4610	5944	-	iucD	NADPH-dependent L-lysine N(6)-monooxygenase IucD	plus	VIRULENCE	VIRULENCE	NA	NA	BLASTX	445	445	100.00	99.78	445	AAD44749.1	NADPH-dependent L-lysine N(6)-monooxygenase IucD	NA	NA
NA	accn|562.98287.con.0080	5944	7683	-	iucC	NIS family aerobactin synthetase IucC	plus	VIRULENCE	VIRULENCE	NA	NA	BLASTX	580	580	100.00	99.48	580	AAN82073.1	NIS family aerobactin synthetase IucC	NA	NA
NA	accn|562.98287.con.0080	7686	8630	-	iucB	N(6)-hydroxylysine O-acetyltransferase IucB	plus	VIRULENCE	VIRULENCE	NA	NA	BLASTX	315	315	100.00	99.68	315	AAN82074.1	N(6)-hydroxylysine O-acetyltransferase IucB	NA	NA
NA	accn|562.98287.con.0080	8634	10355	-	iucA	aerobactin synthase IucA	plus	VIRULENCE	VIRULENCE	NA	NA	INTERNAL_STOP	574	576	100.00	98.26	576	EGI25746.1	aerobactin synthase IucA	NA	NA
NA	accn|562.98287.con.0083	10907	11992	+	capU	putative hexosyltransferase CapU	plus	VIRULENCE	VIRULENCE	NA	NA	BLASTX	362	362	100.00	99.72	362	CAV02025.1	putative hexosyltransferase CapU	NA	NA
NA	accn|562.98287.con.0090	271	1497	+	mdtM	multidrug efflux MFS transporter MdtM	plus	AMR	AMR	EFFLUX	EFFLUX	BLASTX	409	410	99.76	97.31	409	AAC77293.1	multidrug efflux MFS transporter MdtM	NA	NA
NA	accn|562.98287.con.0096	1026	2198	-	senB	enterotoxin production-related protein TieB	plus	VIRULENCE	VIRULENCE	NA	NA	EXACTX	391	391	100.00	100.00	391	AAZ89288.1	enterotoxin production-related protein TieB	NA	NA
NA	accn|562.98287.con.0106	2	358	+	papH	P fimbrial minor subunit PapH	plus	VIRULENCE	VIRULENCE	NA	NA	PARTIAL_CONTIG_ENDX	119	195	61.03	99.16	119	CAA43563.1	P fimbrial minor subunit PapH	NA	NA
NA	accn|562.98287.con.0106	420	2927	+	papC	P fimbrial usher protein PapC	plus	VIRULENCE	VIRULENCE	NA	NA	BLASTX	836	836	100.00	96.31	841	CAA43564.1	P fimbrial usher protein PapC	NA	NA
NA	accn|562.98287.con.0106	5525	6022	+	papF	P fimbrial tip protein PapF	plus	VIRULENCE	VIRULENCE	NA	NA	BLASTX	166	167	100.00	91.02	167	CAA43569.1	P fimbrial tip protein PapF	NA	NA
NA	accn|562.98287.con.0106	6069	7076	+	papG-II	P fimbria tip G-adhesin PapG-II	plus	VIRULENCE	VIRULENCE	NA	NA	BLASTX	336	337	100.00	97.63	337	AAA24293.1	P fimbria tip G-adhesin PapG-II	NA	NA
NA	accn|562.98287.con.0141	3	2780	-	acrF	multidrug efflux RND transporter permease subunit AcrF	plus	AMR	AMR	EFFLUX	EFFLUX	PARTIAL_CONTIG_ENDX	926	1034	89.56	99.24	926	AAC76298.1	multidrug efflux RND transporter permease subunit AcrF	NA	NA
NA	accn|562.98287.con.0207	89	652	+	papA	P fimbria major subunit PapA	plus	VIRULENCE	VIRULENCE	NA	NA	BLASTX	188	185	100.00	86.24	189	CAA43562.1	P fimbria major subunit PapA	NA	NA
