Protein identifier	Contig id	Start	Stop	Strand	Gene symbol	Sequence name	Scope	Element type	Element subtype	Class	Subclass	Method	Target length	Reference sequence length	% Coverage of reference sequence	% Identity to reference sequence	Alignment length	Accession of closest sequence	Name of closest sequence	HMM id	HMM description
NA	accn|562.135593.con.0001	56783	58582	+	ybtP	yersiniabactin ABC transporter ATP-binding/permease protein YbtP	plus	VIRULENCE	VIRULENCE	NA	NA	BLASTX	600	600	100.00	99.67	600	CAA21388.1	yersiniabactin ABC transporter ATP-binding/permease protein YbtP	NA	NA
NA	accn|562.135593.con.0001	58572	60371	+	ybtQ	yersiniabactin ABC transporter ATP-binding/permease protein YbtQ	plus	VIRULENCE	VIRULENCE	NA	NA	BLASTX	600	600	100.00	99.67	600	AAC69584.1	yersiniabactin ABC transporter ATP-binding/permease protein YbtQ	NA	NA
NA	accn|562.135593.con.0002	203618	206242	-	gyrA_D87N	Escherichia quinolone resistant GyrA	core	AMR	POINT	QUINOLONE	QUINOLONE	POINTX	875	878	99.66	98.97	875	WP_001281243.1	DNA gyrase subunit A GyrA	NA	NA
NA	accn|562.135593.con.0002	203618	206242	-	gyrA_S83L	Escherichia quinolone resistant GyrA	core	AMR	POINT	QUINOLONE	QUINOLONE	POINTX	875	878	99.66	98.97	875	WP_001281243.1	DNA gyrase subunit A GyrA	NA	NA
NA	accn|562.135593.con.0005	5249	6664	-	espX1	type III secretion system effector EspX1	plus	VIRULENCE	VIRULENCE	NA	NA	BLASTX	472	473	99.79	92.37	472	ADD54679.1	type III secretion system effector EspX1	NA	NA
NA	accn|562.135593.con.0005	77763	79538	+	ftsI_N337NYRIN	Escherichia aztreonam/cefiderocol/cephalosporin resistant FtsI	core	AMR	POINT	BETA-LACTAM	AZTREONAM/CEFIDEROCOL/CEPHALOSPORIN	POINTX	592	592	100.00	99.49	592	WP_000642196.1	penicillin-binding protein PBP3 FtsI	NA	NA
NA	accn|562.135593.con.0007	69844	72099	-	parC_S80I	Escherichia quinolone resistant ParC	core	AMR	POINT	QUINOLONE	QUINOLONE	POINTX	752	752	100.00	99.73	752	WP_001281881.1	DNA topoisomerase IV subunit A ParC	NA	NA
NA	accn|562.135593.con.0007	79633	81522	-	parE_S458A	Escherichia quinolone resistant ParE	core	AMR	POINT	QUINOLONE	QUINOLONE	POINTX	630	630	100.00	99.68	630	WP_033554192.1	DNA topoisomerase IV subunit B ParE	NA	NA
NA	accn|562.135593.con.0018	65140	66270	+	blaEC	BlaEC family class C beta-lactamase	plus	AMR	AMR	BETA-LACTAM	BETA-LACTAM	BLASTX	377	377	100.00	98.14	377	WP_063610930.1	extended-spectrum class C beta-lactamase EC-15	NA	NA
NA	accn|562.135593.con.0022	13308	13598	+	iss	increased serum survival lipoprotein Iss	plus	VIRULENCE	VIRULENCE	NA	NA	EXACTX	97	97	100.00	100.00	97	BAG76115.1	increased serum survival lipoprotein Iss	NA	NA
NA	accn|562.135593.con.0026	41373	45620	-	fdeC	inverse autotransporter adhesin FdeC	plus	VIRULENCE	VIRULENCE	NA	NA	BLASTX	1416	1416	100.00	94.07	1416	ABE05822.1	inverse autotransporter adhesin FdeC	NA	NA
NA	accn|562.135593.con.0042	19494	19757	+	ariR	biofilm/acid-resistance regulator AriR	plus	STRESS	ACID	NA	NA	EXACTX	88	88	100.00	100.00	88	AAC74250.1	biofilm/acid-resistance regulator AriR	NA	NA
NA	accn|562.135593.con.0046	17414	17974	+	papA	P fimbria major subunit PapA	plus	VIRULENCE	VIRULENCE	NA	NA	BLASTX	187	185	100.00	85.64	188	CAA43562.1	P fimbria major subunit PapA	NA	NA
NA	accn|562.135593.con.0046	18686	21193	+	papC	P fimbrial usher protein PapC	plus	VIRULENCE	VIRULENCE	NA	NA	BLASTX	836	836	100.00	96.31	841	CAA43564.1	P fimbrial usher protein PapC	NA	NA
NA	accn|562.135593.con.0046	23794	24291	+	papF	P fimbrial tip protein PapF	plus	VIRULENCE	VIRULENCE	NA	NA	BLASTX	166	167	100.00	91.02	167	CAA43569.1	P fimbrial tip protein PapF	NA	NA
NA	accn|562.135593.con.0046	24338	25345	+	papG-II	P fimbria tip G-adhesin PapG-II	plus	VIRULENCE	VIRULENCE	NA	NA	BLASTX	336	337	100.00	97.63	337	AAA24293.1	P fimbria tip G-adhesin PapG-II	NA	NA
NA	accn|562.135593.con.0052	17729	18955	-	mdtM	multidrug efflux MFS transporter MdtM	plus	AMR	AMR	EFFLUX	EFFLUX	BLASTX	409	410	99.76	97.31	409	AAC77293.1	multidrug efflux MFS transporter MdtM	NA	NA
NA	accn|562.135593.con.0054	3473	3763	-	iss	increased serum survival lipoprotein Iss	plus	VIRULENCE	VIRULENCE	NA	NA	BLASTX	97	97	100.00	98.97	97	ADN71659.1	increased serum survival lipoprotein Iss	NA	NA
NA	accn|562.135593.con.0061	7082	8803	+	iucA	aerobactin synthase IucA	plus	VIRULENCE	VIRULENCE	NA	NA	BLASTX	574	576	100.00	95.14	576	EGI25746.1	aerobactin synthase IucA	NA	NA
NA	accn|562.135593.con.0061	8807	9751	+	iucB	N(6)-hydroxylysine O-acetyltransferase IucB	plus	VIRULENCE	VIRULENCE	NA	NA	BLASTX	315	315	100.00	96.19	315	AAN82074.1	N(6)-hydroxylysine O-acetyltransferase IucB	NA	NA
NA	accn|562.135593.con.0061	9754	11493	+	iucC	NIS family aerobactin synthetase IucC	plus	VIRULENCE	VIRULENCE	NA	NA	BLASTX	580	580	100.00	97.59	580	AAN82073.1	NIS family aerobactin synthetase IucC	NA	NA
NA	accn|562.135593.con.0061	11493	12767	+	iucD	NADPH-dependent L-lysine N(6)-monooxygenase IucD	plus	VIRULENCE	VIRULENCE	NA	NA	BLASTX	425	445	95.51	97.65	425	AAD44749.1	NADPH-dependent L-lysine N(6)-monooxygenase IucD	NA	NA
NA	accn|562.135593.con.0061	12864	15050	+	iutA	ferric aerobactin receptor IutA	plus	VIRULENCE	VIRULENCE	NA	NA	BLASTX	729	731	99.73	89.85	729	AAN45165.2	ferric aerobactin receptor IutA	NA	NA
NA	accn|562.135593.con.0063	496	1305	+	blaNDM-5	subclass B1 metallo-beta-lactamase NDM-5	core	AMR	AMR	BETA-LACTAM	CARBAPENEM	ALLELEX	270	270	100.00	100.00	270	WP_023408309.1	subclass B1 metallo-beta-lactamase NDM-5	NA	NA
NA	accn|562.135593.con.0063	1312	1674	+	ble	bleomycin binding protein Ble-MBL	core	AMR	AMR	BLEOMYCIN	BLEOMYCIN	EXACTX	121	121	100.00	100.00	121	WP_004201167.1	bleomycin binding protein Ble-MBL	NA	NA
NA	accn|562.135593.con.0063	5623	6459	-	sul1	sulfonamide-resistant dihydropteroate synthase Sul1	core	AMR	AMR	SULFONAMIDE	SULFONAMIDE	EXACTX	279	279	100.00	100.00	279	WP_000259031.1	sulfonamide-resistant dihydropteroate synthase Sul1	NA	NA
NA	accn|562.135593.con.0063	6456	6800	-	qacEdelta1	quaternary ammonium compound efflux SMR transporter QacE delta 1	core	STRESS	BIOCIDE	QUATERNARY AMMONIUM	QUATERNARY AMMONIUM	ALLELEX	115	115	100.00	100.00	115	WP_000679427.1	quaternary ammonium compound efflux SMR transporter QacE delta 1	NA	NA
NA	accn|562.135593.con.0063	6995	8251	-	cmlA5	chloramphenicol efflux MFS transporter CmlA5	core	AMR	AMR	PHENICOL	CHLORAMPHENICOL	EXACTX	419	419	100.00	100.00	419	WP_012300772.1	chloramphenicol efflux MFS transporter CmlA5	NA	NA
NA	accn|562.135593.con.0063	8476	9264	-	aadA1	ANT(3'')-Ia family aminoglycoside nucleotidyltransferase AadA1	core	AMR	AMR	AMINOGLYCOSIDE	STREPTOMYCIN	EXACTX	263	263	100.00	100.00	263	WP_001209508.1	ANT(3'')-Ia family aminoglycoside nucleotidyltransferase AadA1	NA	NA
NA	accn|562.135593.con.0063	9353	10606	-	ere(A)	EreA family erythromycin esterase	core	AMR	AMR	MACROLIDE	ERYTHROMYCIN	EXACTX	418	418	100.00	100.00	418	WP_015059985.1	EreA family erythromycin esterase	NA	NA
NA	accn|562.135593.con.0063	10855	11304	-	arr-2	NAD(+)--rifampin ADP-ribosyltransferase Arr-2	core	AMR	AMR	RIFAMYCIN	RIFAMYCIN	ALLELEX	150	150	100.00	100.00	150	WP_000237816.1	NAD(+)--rifampin ADP-ribosyltransferase Arr-2	NA	NA
NA	accn|562.135593.con.0068	1750	2835	+	capU	putative hexosyltransferase CapU	plus	VIRULENCE	VIRULENCE	NA	NA	BLASTX	362	362	100.00	99.72	362	CAV02025.1	putative hexosyltransferase CapU	NA	NA
NA	accn|562.135593.con.0070	5558	8659	-	acrF	multidrug efflux RND transporter permease subunit AcrF	plus	AMR	AMR	EFFLUX	EFFLUX	EXACTX	1034	1034	100.00	100.00	1034	AAC76298.1	multidrug efflux RND transporter permease subunit AcrF	NA	NA
NA	accn|562.135593.con.0074	951	2123	-	senB	enterotoxin production-related protein TieB	plus	VIRULENCE	VIRULENCE	NA	NA	EXACTX	391	391	100.00	100.00	391	AAZ89288.1	enterotoxin production-related protein TieB	NA	NA
NA	accn|562.135593.con.0078	2001	3203	+	tet(B)	tetracycline efflux MFS transporter Tet(B)	core	AMR	AMR	TETRACYCLINE	TETRACYCLINE	EXACTX	401	401	100.00	100.00	401	WP_001089068.1	tetracycline efflux MFS transporter Tet(B)	NA	NA
NA	accn|562.135593.con.0082	70	972	+	mph(A)	Mph(A) family macrolide 2'-phosphotransferase	core	AMR	AMR	MACROLIDE	AZITHROMYCIN/ERYTHROMYCIN/SPIRAMYCIN/TELITHROMYCIN	BLASTX	301	301	100.00	100.00	301	WP_000219391.1	Mph(A) family macrolide 2'-phosphotransferase	NA	NA
NA	accn|562.135593.con.0083	1113	1970	+	blaTEM-1	broad-spectrum class A beta-lactamase TEM-1	core	AMR	AMR	BETA-LACTAM	BETA-LACTAM	ALLELEX	286	286	100.00	100.00	286	WP_000027057.1	broad-spectrum class A beta-lactamase TEM-1	NA	NA
NA	accn|562.135593.con.0083	2143	2895	+	rmtB1	16S rRNA (guanine(1405)-N(7))-methyltransferase RmtB1	core	AMR	AMR	AMINOGLYCOSIDE	AMINOGLYCOSIDE	ALLELEX	251	251	100.00	100.00	251	WP_012372818.1	16S rRNA (guanine(1405)-N(7))-methyltransferase RmtB1	NA	NA
NA	accn|562.135593.con.0084	293	1027	+	erm(B)	23S rRNA (adenine(2058)-N(6))-methyltransferase Erm(B)	core	AMR	AMR	LINCOSAMIDE/MACROLIDE/STREPTOGRAMIN	CLINDAMYCIN/ERYTHROMYCIN/STREPTOGRAMIN B	BLASTX	245	245	100.00	99.59	245	WP_002321849.1	23S rRNA (adenine(2058)-N(6))-methyltransferase Erm(B)	NA	NA
NA	accn|562.135593.con.0096	2	442	-	catB3	type B-3 chloramphenicol O-acetyltransferase CatB3	core	AMR	AMR	PHENICOL	CHLORAMPHENICOL	PARTIAL_CONTIG_ENDX	147	210	70.00	100.00	147	WP_000186237.1	type B-3 chloramphenicol O-acetyltransferase CatB3	NA	NA
NA	accn|562.135593.con.0096	583	1410	-	blaOXA-1	oxacillin-hydrolyzing class D beta-lactamase OXA-1	core	AMR	AMR	BETA-LACTAM	CEPHALOSPORIN	ALLELEX	276	276	100.00	100.00	276	WP_001334766.1	oxacillin-hydrolyzing class D beta-lactamase OXA-1	NA	NA
NA	accn|562.135593.con.0096	1544	2095	-	aac(6')-Ib-cr5	fluoroquinolone-acetylating aminoglycoside 6'-N-acetyltransferase AAC(6')-Ib-cr5	core	AMR	AMR	AMINOGLYCOSIDE/QUINOLONE	AMIKACIN/KANAMYCIN/QUINOLONE/TOBRAMYCIN	ALLELEX	184	184	100.00	100.00	184	WP_063840321.1	fluoroquinolone-acetylating aminoglycoside 6'-N-acetyltransferase AAC(6')-Ib-cr5	NA	NA
NA	accn|562.135593.con.0106	395	1267	-	blaCTX-M-15	extended-spectrum class A beta-lactamase CTX-M-15	core	AMR	AMR	BETA-LACTAM	CEPHALOSPORIN	ALLELEX	291	291	100.00	100.00	291	WP_000239590.1	extended-spectrum class A beta-lactamase CTX-M-15	NA	NA
NA	accn|562.135593.con.0123	223	879	+	catA1	type A-1 chloramphenicol O-acetyltransferase	core	AMR	AMR	PHENICOL	CHLORAMPHENICOL	EXACTX	219	219	100.00	100.00	219	WP_000412211.1	type A-1 chloramphenicol O-acetyltransferase	NA	NA
