Protein identifier	Contig id	Start	Stop	Strand	Gene symbol	Sequence name	Scope	Element type	Element subtype	Class	Subclass	Method	Target length	Reference sequence length	% Coverage of reference sequence	% Identity to reference sequence	Alignment length	Accession of closest sequence	Name of closest sequence	HMM id	HMM description
NA	accn|562.22594.con.0001	226058	227413	-	glpT_E448K	Escherichia fosfomycin resistant GlpT	core	AMR	POINT	FOSFOMYCIN	FOSFOMYCIN	POINTX	452	452	100.00	99.78	452	WP_000948731.1	glycerol-3-phosphate transporter GlpT	NA	NA
NA	accn|562.22594.con.0002	58906	60705	+	ybtP	yersiniabactin ABC transporter ATP-binding/permease protein YbtP	plus	VIRULENCE	VIRULENCE	NA	NA	BLASTX	600	600	100.00	99.83	600	CAA21388.1	yersiniabactin ABC transporter ATP-binding/permease protein YbtP	NA	NA
NA	accn|562.22594.con.0002	60695	62494	+	ybtQ	yersiniabactin ABC transporter ATP-binding/permease protein YbtQ	plus	VIRULENCE	VIRULENCE	NA	NA	BLASTX	600	600	100.00	99.50	600	AAC69584.1	yersiniabactin ABC transporter ATP-binding/permease protein YbtQ	NA	NA
NA	accn|562.22594.con.0002	120595	120924	+	emrE	multidrug efflux SMR transporter EmrE	plus	STRESS	BIOCIDE	EFFLUX	EFFLUX	BLASTX	110	110	100.00	98.18	110	CAA77936.1	multidrug efflux SMR transporter EmrE	NA	NA
NA	accn|562.22594.con.0004	260560	260823	-	ariR	biofilm/acid-resistance regulator AriR	plus	STRESS	ACID	NA	NA	BLASTX	88	88	100.00	97.73	88	AAC74250.1	biofilm/acid-resistance regulator AriR	NA	NA
NA	accn|562.22594.con.0009	82087	83274	-	emrD	multidrug efflux MFS transporter EmrD	plus	AMR	AMR	EFFLUX	EFFLUX	BLASTX	396	396	100.00	99.49	396	EFF04178.1	multidrug efflux MFS transporter EmrD	NA	NA
NA	accn|562.22594.con.0015	29382	32042	-	vactox	vacuolating autotransporter toxin Vat	plus	VIRULENCE	VIRULENCE	NA	NA	PARTIALX	887	1376	64.46	99.66	887	AAN78874.1	vacuolating autotransporter toxin Vat	NA	NA
NA	accn|562.22594.con.0015	54710	57451	+	fdeC	inverse autotransporter adhesin FdeC	plus	VIRULENCE	VIRULENCE	NA	NA	PARTIALX	914	1416	64.55	99.67	914	ABE05822.1	inverse autotransporter adhesin FdeC	NA	NA
NA	accn|562.22594.con.0018	93321	96422	+	acrF	multidrug efflux RND transporter permease subunit AcrF	plus	AMR	AMR	EFFLUX	EFFLUX	BLASTX	1034	1034	100.00	99.52	1034	AAC76298.1	multidrug efflux RND transporter permease subunit AcrF	NA	NA
NA	accn|562.22594.con.0024	40964	42052	-	pmrB_E123D	Escherichia colistin resistant PmrB	core	AMR	POINT	COLISTIN	COLISTIN	POINTX	363	363	100.00	98.90	363	WP_001300761.1	two-component system sensor histidine kinase PmrB	NA	NA
NA	accn|562.22594.con.0033	17618	20689	+	hlyA-alpha	RTX toxin hemolysin HlyA	plus	VIRULENCE	VIRULENCE	NA	NA	BLASTX	1024	1024	100.00	97.27	1024	CAQ77251.1	RTX toxin hemolysin HlyA	NA	NA
NA	accn|562.22594.con.0033	25287	28328	+	cnf1	cytotoxic necrotizing factor CNF1	plus	VIRULENCE	VIRULENCE	NA	NA	BLASTX	1014	1014	100.00	99.90	1014	ABE10324.1	cytotoxic necrotizing factor CNF1	NA	NA
NA	accn|562.22594.con.0034	14912	16042	-	blaEC-5	cephalosporin-hydrolyzing class C beta-lactamase EC-5	plus	AMR	AMR	BETA-LACTAM	CEPHALOSPORIN	ALLELEX	377	377	100.00	100.00	377	AAZ85965.1	cephalosporin-hydrolyzing class C beta-lactamase EC-5	NA	NA
NA	accn|562.22594.con.0035	18822	19934	+	iroB	salmochelin biosynthesis C-glycosyltransferase IroB	plus	VIRULENCE	VIRULENCE	NA	NA	BLASTX	371	371	100.00	99.19	371	EOW04219.1	salmochelin biosynthesis C-glycosyltransferase IroB	NA	NA
NA	accn|562.22594.con.0035	20077	23733	+	iroC	salmochelin/enterobactin export ABC transporter IroC	plus	VIRULENCE	VIRULENCE	NA	NA	BLASTX	1219	1219	100.00	99.59	1219	AUH19662.1	salmochelin/enterobactin export ABC transporter IroC	NA	NA
NA	accn|562.22594.con.0035	23840	25066	+	iroD	catecholate siderophore esterase IroD	plus	VIRULENCE	VIRULENCE	NA	NA	BLASTX	409	409	100.00	99.51	409	ACJ63529.1	catecholate siderophore esterase IroD	NA	NA
NA	accn|562.22594.con.0035	25154	26107	+	iroE	catecholate siderophore esterase IroE	plus	VIRULENCE	VIRULENCE	NA	NA	BLASTX	318	318	100.00	99.06	318	ACJ63530.1	catecholate siderophore esterase IroE	NA	NA
NA	accn|562.22594.con.0035	26158	28332	-	iroN	siderophore salmochelin receptor IroN	plus	VIRULENCE	VIRULENCE	NA	NA	EXACTX	725	725	100.00	100.00	725	AAN79707.1	siderophore salmochelin receptor IroN	NA	NA
NA	accn|562.22594.con.0038	973	3060	+	iha	bifunctional siderophore receptor/adhesin Iha	plus	VIRULENCE	VIRULENCE	NA	NA	EXACTX	696	696	100.00	100.00	696	ADN47767.1	bifunctional siderophore receptor/adhesin Iha	NA	NA
NA	accn|562.22594.con.0038	11577	15461	-	sat	serine protease autotransporter toxin Sat	plus	VIRULENCE	VIRULENCE	NA	NA	EXACTX	1295	1295	100.00	100.00	1295	CAE55775.1	serine protease autotransporter toxin Sat	NA	NA
NA	accn|562.22594.con.0038	16408	18594	-	iutA	ferric aerobactin receptor IutA	plus	VIRULENCE	VIRULENCE	NA	NA	BLASTX	729	731	99.73	89.85	729	AAN45165.2	ferric aerobactin receptor IutA	NA	NA
NA	accn|562.22594.con.0038	18691	19965	-	iucD	NADPH-dependent L-lysine N(6)-monooxygenase IucD	plus	VIRULENCE	VIRULENCE	NA	NA	BLASTX	425	445	95.51	97.65	425	AAD44749.1	NADPH-dependent L-lysine N(6)-monooxygenase IucD	NA	NA
NA	accn|562.22594.con.0038	19965	21704	-	iucC	NIS family aerobactin synthetase IucC	plus	VIRULENCE	VIRULENCE	NA	NA	BLASTX	580	580	100.00	99.14	580	AAN82073.1	NIS family aerobactin synthetase IucC	NA	NA
NA	accn|562.22594.con.0038	21707	22651	-	iucB	N(6)-hydroxylysine O-acetyltransferase IucB	plus	VIRULENCE	VIRULENCE	NA	NA	BLASTX	315	315	100.00	99.37	315	AAN82074.1	N(6)-hydroxylysine O-acetyltransferase IucB	NA	NA
NA	accn|562.22594.con.0038	22655	24376	-	iucA	aerobactin synthase IucA	plus	VIRULENCE	VIRULENCE	NA	NA	BLASTX	574	576	100.00	98.61	576	EGI25746.1	aerobactin synthase IucA	NA	NA
NA	accn|562.22594.con.0041	150	491	-	merR	mercury resistance transcriptional regulator MerR	plus	STRESS	METAL	MERCURY	MERCURY	PARTIALX	114	144	79.17	92.11	114	CAA77320.1	mercury resistance transcriptional regulator MerR	NA	NA
NA	accn|562.22594.con.0041	2623	3411	+	aadA1	ANT(3'')-Ia family aminoglycoside nucleotidyltransferase AadA1	core	AMR	AMR	AMINOGLYCOSIDE	STREPTOMYCIN	EXACTX	263	263	100.00	100.00	263	WP_001206316.1	ANT(3'')-Ia family aminoglycoside nucleotidyltransferase AadA1	NA	NA
NA	accn|562.22594.con.0041	3578	3922	+	qacEdelta1	quaternary ammonium compound efflux SMR transporter QacE delta 1	core	STRESS	BIOCIDE	QUATERNARY AMMONIUM	QUATERNARY AMMONIUM	ALLELEX	115	115	100.00	100.00	115	WP_000679427.1	quaternary ammonium compound efflux SMR transporter QacE delta 1	NA	NA
NA	accn|562.22594.con.0041	3919	4755	+	sul1	sulfonamide-resistant dihydropteroate synthase Sul1	core	AMR	AMR	SULFONAMIDE	SULFONAMIDE	EXACTX	279	279	100.00	100.00	279	WP_000259031.1	sulfonamide-resistant dihydropteroate synthase Sul1	NA	NA
NA	accn|562.22594.con.0044	5558	9670	-	pic	serine protease autotransporter toxin Pic	plus	VIRULENCE	VIRULENCE	NA	NA	EXACTX	1371	1371	100.00	100.00	1371	AAN78833.1	serine protease autotransporter toxin Pic	NA	NA
NA	accn|562.22594.con.0048	11518	11808	-	iss	increased serum survival lipoprotein Iss	plus	VIRULENCE	VIRULENCE	NA	NA	EXACTX	97	97	100.00	100.00	97	ADN71659.1	increased serum survival lipoprotein Iss	NA	NA
NA	accn|562.22594.con.0051	9518	10690	+	senB	enterotoxin production-related protein TieB	plus	VIRULENCE	VIRULENCE	NA	NA	EXACTX	391	391	100.00	100.00	391	AAZ89288.1	enterotoxin production-related protein TieB	NA	NA
NA	accn|562.22594.con.0053	5381	8008	+	sfaF	S/F1C fimbrial biogenesis usher protein SfaF/FocD	plus	VIRULENCE	VIRULENCE	NA	NA	EXACTX	876	876	100.00	100.00	876	EIL44824.1	S/F1C fimbrial biogenesis usher protein SfaF/FocD	NA	NA
NA	accn|562.22594.con.0053	8573	9073	+	focG	F1C fimbria minor subunit FocG	plus	VIRULENCE	VIRULENCE	NA	NA	BLASTX	167	166	100.00	98.80	167	AAB20438.1	F1C fimbria minor subunit FocG	NA	NA
NA	accn|562.22594.con.0057	2	415	+	papA	P fimbria major subunit PapA	plus	VIRULENCE	VIRULENCE	NA	NA	PARTIAL_CONTIG_ENDX	138	185	74.59	99.28	138	CAA43562.1	P fimbria major subunit PapA	NA	NA
NA	accn|562.22594.con.0057	482	1066	+	papH	P fimbrial minor subunit PapH	plus	VIRULENCE	VIRULENCE	NA	NA	BLASTX	195	195	100.00	98.97	195	CAA43563.1	P fimbrial minor subunit PapH	NA	NA
NA	accn|562.22594.con.0057	1128	3635	+	papC	P fimbrial usher protein PapC	plus	VIRULENCE	VIRULENCE	NA	NA	BLASTX	836	836	100.00	96.31	841	CAA43564.1	P fimbrial usher protein PapC	NA	NA
NA	accn|562.22594.con.0057	5634	6152	+	papE	P fimbrial minor subunit PapE	plus	VIRULENCE	VIRULENCE	NA	NA	BLASTX	173	173	100.00	91.33	173	CAA43568.1	P fimbrial minor subunit PapE	NA	NA
NA	accn|562.22594.con.0057	6230	6727	+	papF	P fimbrial tip protein PapF	plus	VIRULENCE	VIRULENCE	NA	NA	BLASTX	166	167	100.00	91.62	167	CAA43569.1	P fimbrial tip protein PapF	NA	NA
NA	accn|562.22594.con.0057	6774	7781	+	papG-II	P fimbria tip G-adhesin PapG-II	plus	VIRULENCE	VIRULENCE	NA	NA	BLASTX	336	337	100.00	98.81	337	AAA24293.1	P fimbria tip G-adhesin PapG-II	NA	NA
NA	accn|562.22594.con.0060	1625	3718	-	mchF	microcin H47 export transporter peptidase/ATP-binding subunit MchF	plus	VIRULENCE	VIRULENCE	NA	NA	BLASTX	698	698	100.00	99.14	698	CAD56186.1	microcin H47 export transporter peptidase/ATP-binding subunit MchF	NA	NA
NA	accn|562.22594.con.0060	7441	7665	-	mchB	microcin H47	plus	VIRULENCE	VIRULENCE	NA	NA	EXACTX	75	75	100.00	100.00	75	CAB54534.2	microcin H47	NA	NA
