Protein identifier	Contig id	Start	Stop	Strand	Gene symbol	Sequence name	Scope	Element type	Element subtype	Class	Subclass	Method	Target length	Reference sequence length	% Coverage of reference sequence	% Identity to reference sequence	Alignment length	Accession of closest sequence	Name of closest sequence	HMM id	HMM description
NA	accn|CM017025	33111	33401	+	iss	increased serum survival lipoprotein Iss	plus	VIRULENCE	VIRULENCE	NA	NA	EXACTX	97	97	100.00	100.00	97	ADR26561.1	increased serum survival lipoprotein Iss	NA	NA
NA	accn|CM017025	36550	37662	+	iroB	salmochelin biosynthesis C-glycosyltransferase IroB	plus	VIRULENCE	VIRULENCE	NA	NA	BLASTX	371	371	100.00	99.73	371	EOW04219.1	salmochelin biosynthesis C-glycosyltransferase IroB	NA	NA
NA	accn|CM017025	37805	41461	+	iroC	salmochelin/enterobactin export ABC transporter IroC	plus	VIRULENCE	VIRULENCE	NA	NA	BLASTX	1219	1219	100.00	99.51	1219	AUH19662.1	salmochelin/enterobactin export ABC transporter IroC	NA	NA
NA	accn|CM017025	41568	42794	+	iroD	catecholate siderophore esterase IroD	plus	VIRULENCE	VIRULENCE	NA	NA	BLASTX	409	409	100.00	99.76	409	ACJ63529.1	catecholate siderophore esterase IroD	NA	NA
NA	accn|CM017025	42882	43835	+	iroE	catecholate siderophore esterase IroE	plus	VIRULENCE	VIRULENCE	NA	NA	BLASTX	318	318	100.00	99.37	318	ACJ63530.1	catecholate siderophore esterase IroE	NA	NA
NA	accn|CM017025	43886	46060	-	iroN	siderophore salmochelin receptor IroN	plus	VIRULENCE	VIRULENCE	NA	NA	EXACTX	725	725	100.00	100.00	725	AAN76093.1	siderophore salmochelin receptor IroN	NA	NA
NA	accn|CM017025	51241	53334	+	cvaB	colicin V export peptidase/ABC transporter CvaB	plus	VIRULENCE	VIRULENCE	NA	NA	EXACTX	698	698	100.00	100.00	698	CAA40744.1	colicin V export peptidase/ABC transporter CvaB	NA	NA
NA	accn|CM017025	53510	53818	-	cvaC	colicin V	plus	VIRULENCE	VIRULENCE	NA	NA	EXACTX	103	103	100.00	100.00	103	CAA40746.1	colicin V	NA	NA
NA	accn|CM017025	68372	69229	-	blaTEM-1	broad-spectrum class A beta-lactamase TEM-1	core	AMR	AMR	BETA-LACTAM	BETA-LACTAM	ALLELEX	286	286	100.00	100.00	286	WP_000027057.1	broad-spectrum class A beta-lactamase TEM-1	NA	NA
NA	accn|CM017025	143436	145622	-	iutA	ferric aerobactin receptor IutA	plus	VIRULENCE	VIRULENCE	NA	NA	BLASTX	729	731	99.73	89.85	729	AAN45165.2	ferric aerobactin receptor IutA	NA	NA
NA	accn|CM017025	145719	146993	-	iucD	NADPH-dependent L-lysine N(6)-monooxygenase IucD	plus	VIRULENCE	VIRULENCE	NA	NA	BLASTX	425	445	95.51	97.65	425	AAD44749.1	NADPH-dependent L-lysine N(6)-monooxygenase IucD	NA	NA
NA	accn|CM017025	146993	148732	-	iucC	NIS family aerobactin synthetase IucC	plus	VIRULENCE	VIRULENCE	NA	NA	BLASTX	580	580	100.00	97.59	580	AAN82073.1	NIS family aerobactin synthetase IucC	NA	NA
NA	accn|CM017025	148735	149679	-	iucB	N(6)-hydroxylysine O-acetyltransferase IucB	plus	VIRULENCE	VIRULENCE	NA	NA	BLASTX	315	315	100.00	96.19	315	AAN82074.1	N(6)-hydroxylysine O-acetyltransferase IucB	NA	NA
NA	accn|CM017025	149683	151404	-	iucA	aerobactin synthase IucA	plus	VIRULENCE	VIRULENCE	NA	NA	BLASTX	574	576	100.00	95.31	576	EGI25746.1	aerobactin synthase IucA	NA	NA
NA	accn|RZAI01000003	110112	111242	+	blaEC	BlaEC family class C beta-lactamase	plus	AMR	AMR	BETA-LACTAM	BETA-LACTAM	INTERNAL_STOP	377	377	100.00	98.14	377	AAZ85968.1	cephalosporin-hydrolyzing class C beta-lactamase EC-8	NA	NA
NA	accn|RZAI01000007	1025	1315	+	iss	increased serum survival lipoprotein Iss	plus	VIRULENCE	VIRULENCE	NA	NA	EXACTX	97	97	100.00	100.00	97	BAG76115.1	increased serum survival lipoprotein Iss	NA	NA
NA	accn|RZAI01000007	11316	11645	-	emrE	multidrug efflux SMR transporter EmrE	plus	STRESS	BIOCIDE	EFFLUX	EFFLUX	BLASTX	110	110	100.00	99.09	110	CAA77936.1	multidrug efflux SMR transporter EmrE	NA	NA
NA	accn|RZAI01000008	143866	146967	+	acrF	multidrug efflux RND transporter permease subunit AcrF	plus	AMR	AMR	EFFLUX	EFFLUX	BLASTX	1034	1034	100.00	99.52	1034	AAC76298.1	multidrug efflux RND transporter permease subunit AcrF	NA	NA
NA	accn|RZAI01000011	102049	103848	-	ybtQ	yersiniabactin ABC transporter ATP-binding/permease protein YbtQ	plus	VIRULENCE	VIRULENCE	NA	NA	BLASTX	600	600	100.00	99.67	600	AAC69584.1	yersiniabactin ABC transporter ATP-binding/permease protein YbtQ	NA	NA
NA	accn|RZAI01000011	103838	105637	-	ybtP	yersiniabactin ABC transporter ATP-binding/permease protein YbtP	plus	VIRULENCE	VIRULENCE	NA	NA	BLASTX	600	600	100.00	99.67	600	CAA21388.1	yersiniabactin ABC transporter ATP-binding/permease protein YbtP	NA	NA
NA	accn|RZAI01000016	28477	32718	-	fdeC	inverse autotransporter adhesin FdeC	plus	VIRULENCE	VIRULENCE	NA	NA	BLASTX	1414	1416	99.93	92.58	1415	ABE05822.1	inverse autotransporter adhesin FdeC	NA	NA
NA	accn|RZAI01000018	69480	70622	-	blaCMY-2	extended-spectrum class C beta-lactamase CMY-2	core	AMR	AMR	BETA-LACTAM	CEPHALOSPORIN	ALLELEX	381	381	100.00	100.00	381	WP_000976514.1	extended-spectrum class C beta-lactamase CMY-2	NA	NA
NA	accn|RZAI01000025	57306	58532	+	mdtM	multidrug efflux MFS transporter MdtM	plus	AMR	AMR	EFFLUX	EFFLUX	BLASTX	409	410	99.76	97.80	409	AAC77293.1	multidrug efflux MFS transporter MdtM	NA	NA
NA	accn|RZAI01000026	59881	62424	-	cyaA_S352T	Escherichia fosmidomycin resistant CyaA	core	AMR	POINT	FOSMIDOMYCIN	FOSMIDOMYCIN	POINTX	848	848	100.00	99.29	848	WP_000281668.1	adenylate cyclase CyaA	NA	NA
NA	accn|RZAI01000028	55049	55906	+	blaTEM-1	broad-spectrum class A beta-lactamase TEM-1	core	AMR	AMR	BETA-LACTAM	BETA-LACTAM	ALLELEX	286	286	100.00	100.00	286	WP_000027057.1	broad-spectrum class A beta-lactamase TEM-1	NA	NA
NA	accn|RZAI01000029	35112	36299	-	emrD	multidrug efflux MFS transporter EmrD	plus	AMR	AMR	EFFLUX	EFFLUX	BLASTX	396	396	100.00	99.75	396	EFF04178.1	multidrug efflux MFS transporter EmrD	NA	NA
NA	accn|RZAI01000029	46398	47786	+	uhpT_E350Q	Escherichia fosfomycin resistant UhpT	core	AMR	POINT	FOSFOMYCIN	FOSFOMYCIN	POINTX	463	463	100.00	99.78	463	WP_000879194.1	hexose phosphate transporter UhpT	NA	NA
NA	accn|RZAI01000029	54011	59758	+	air	inverse autotransporter adhesin EaeX/Air	plus	VIRULENCE	VIRULENCE	NA	NA	PARTIAL_CONTIG_ENDX	1916	2933	65.33	95.46	1916	ACB17037.1	inverse autotransporter adhesin EaeX/Air	NA	NA
NA	accn|RZAI01000031	6244	6552	+	cvaC	colicin V	plus	VIRULENCE	VIRULENCE	NA	NA	EXACTX	103	103	100.00	100.00	103	CAA40746.1	colicin V	NA	NA
NA	accn|RZAI01000031	6728	8821	-	cvaB	colicin V export peptidase/ABC transporter CvaB	plus	VIRULENCE	VIRULENCE	NA	NA	EXACTX	698	698	100.00	100.00	698	CAA40744.1	colicin V export peptidase/ABC transporter CvaB	NA	NA
NA	accn|RZAI01000031	14002	16176	+	iroN	siderophore salmochelin receptor IroN	plus	VIRULENCE	VIRULENCE	NA	NA	EXACTX	725	725	100.00	100.00	725	AAN76093.1	siderophore salmochelin receptor IroN	NA	NA
NA	accn|RZAI01000031	16227	17180	-	iroE	catecholate siderophore esterase IroE	plus	VIRULENCE	VIRULENCE	NA	NA	BLASTX	318	318	100.00	99.37	318	ACJ63530.1	catecholate siderophore esterase IroE	NA	NA
NA	accn|RZAI01000031	17268	18494	-	iroD	catecholate siderophore esterase IroD	plus	VIRULENCE	VIRULENCE	NA	NA	BLASTX	409	409	100.00	99.76	409	ACJ63529.1	catecholate siderophore esterase IroD	NA	NA
NA	accn|RZAI01000031	18601	22257	-	iroC	salmochelin/enterobactin export ABC transporter IroC	plus	VIRULENCE	VIRULENCE	NA	NA	BLASTX	1219	1219	100.00	99.51	1219	AUH19662.1	salmochelin/enterobactin export ABC transporter IroC	NA	NA
NA	accn|RZAI01000031	22400	23512	-	iroB	salmochelin biosynthesis C-glycosyltransferase IroB	plus	VIRULENCE	VIRULENCE	NA	NA	BLASTX	371	371	100.00	99.73	371	EOW04219.1	salmochelin biosynthesis C-glycosyltransferase IroB	NA	NA
NA	accn|RZAI01000031	26661	26951	-	iss	increased serum survival lipoprotein Iss	plus	VIRULENCE	VIRULENCE	NA	NA	EXACTX	97	97	100.00	100.00	97	ADR26561.1	increased serum survival lipoprotein Iss	NA	NA
NA	accn|RZAI01000033	31644	32999	+	glpT_E448K	Escherichia fosfomycin resistant GlpT	core	AMR	POINT	FOSFOMYCIN	FOSFOMYCIN	POINTX	452	452	100.00	99.12	452	WP_000948731.1	glycerol-3-phosphate transporter GlpT	NA	NA
NA	accn|RZAI01000038	11479	12048	-	lpfA-O113	long polar fimbria major subunit LpfA-O113	plus	VIRULENCE	VIRULENCE	NA	NA	EXACTX	190	190	100.00	100.00	190	ACB16424.1	long polar fimbria major subunit LpfA-O113	NA	NA
NA	accn|RZAI01000064	7209	8930	+	iucA	aerobactin synthase IucA	plus	VIRULENCE	VIRULENCE	NA	NA	BLASTX	574	576	100.00	95.31	576	EGI25746.1	aerobactin synthase IucA	NA	NA
NA	accn|RZAI01000064	8934	9878	+	iucB	N(6)-hydroxylysine O-acetyltransferase IucB	plus	VIRULENCE	VIRULENCE	NA	NA	BLASTX	315	315	100.00	96.19	315	AAN82074.1	N(6)-hydroxylysine O-acetyltransferase IucB	NA	NA
NA	accn|RZAI01000064	9881	11620	+	iucC	NIS family aerobactin synthetase IucC	plus	VIRULENCE	VIRULENCE	NA	NA	BLASTX	580	580	100.00	97.59	580	AAN82073.1	NIS family aerobactin synthetase IucC	NA	NA
NA	accn|RZAI01000064	11620	12894	+	iucD	NADPH-dependent L-lysine N(6)-monooxygenase IucD	plus	VIRULENCE	VIRULENCE	NA	NA	BLASTX	425	445	95.51	97.65	425	AAD44749.1	NADPH-dependent L-lysine N(6)-monooxygenase IucD	NA	NA
NA	accn|RZAI01000064	12991	15177	+	iutA	ferric aerobactin receptor IutA	plus	VIRULENCE	VIRULENCE	NA	NA	BLASTX	729	731	99.73	89.85	729	AAN45165.2	ferric aerobactin receptor IutA	NA	NA
NA	accn|RZAI01000070	3932	4195	+	ariR	biofilm/acid-resistance regulator AriR	plus	STRESS	ACID	NA	NA	BLASTX	88	88	100.00	96.59	88	AAC74250.1	biofilm/acid-resistance regulator AriR	NA	NA
NA	accn|RZAI01000080	4398	5990	-	eilA	HilA family transcriptional regulator EilA	plus	VIRULENCE	VIRULENCE	NA	NA	BLASTX	531	565	93.98	99.81	531	ACB16655.1	HilA family transcriptional regulator EilA	NA	NA
